{
  "version": 1,
  "timezone": "Europe/Lisbon",
  "defaultRemindersDays": [
    30,
    14,
    7,
    2
  ],
  "decisions": [
    {
      "id": "review-matosinhos-aba-associacao-baptista-agape",
      "title": "Rever: ABA - Associação Baptista Ágape",
      "type": "review",
      "owner": "human",
      "timing": {
        "kind": "unknown"
      },
      "state": "unknown",
      "remindersDays": [],
      "dependsOn": [],
      "issueNumber": 19,
      "source": null,
      "notes": "Revisão dos dados pesquisados; comentar aceite ou rejeitado na issue."
    },
    {
      "id": "review-matosinhos-amas-associacao-mamedense-de-apoio-social",
      "title": "Rever: AMAS - Associação Mamedense de Apoio Social",
      "type": "review",
      "owner": "human",
      "timing": {
        "kind": "unknown"
      },
      "state": "unknown",
      "remindersDays": [],
      "dependsOn": [],
      "issueNumber": 20,
      "source": null,
      "notes": "Revisão dos dados pesquisados; comentar aceite ou rejeitado na issue."
    },
    {
      "id": "review-matosinhos-asdg-associacao-social-e-de-desenvolvimento-de-guifoes",
      "title": "Rever: ASDG - Associação Social e de Desenvolvimento de Guifões",
      "type": "review",
      "owner": "human",
      "timing": {
        "kind": "unknown"
      },
      "state": "unknown",
      "remindersDays": [],
      "dependsOn": [],
      "issueNumber": 21,
      "source": null,
      "notes": "Revisão dos dados pesquisados; comentar aceite ou rejeitado na issue."
    },
    {
      "id": "review-matosinhos-associacao-mais-santiago-custoias",
      "title": "Rever: Associação MAIS (Santiago/Custoias)",
      "type": "review",
      "owner": "human",
      "timing": {
        "kind": "unknown"
      },
      "state": "unknown",
      "remindersDays": [],
      "dependsOn": [],
      "issueNumber": 22,
      "source": null,
      "notes": "Revisão dos dados pesquisados; comentar aceite ou rejeitado na issue."
    },
    {
      "id": "review-matosinhos-associacao-mais-sol-poente",
      "title": "Rever: Associação MAIS (Sol Poente)",
      "type": "review",
      "owner": "human",
      "timing": {
        "kind": "unknown"
      },
      "state": "unknown",
      "remindersDays": [],
      "dependsOn": [],
      "issueNumber": 23,
      "source": null,
      "notes": "Revisão dos dados pesquisados; comentar aceite ou rejeitado na issue."
    },
    {
      "id": "review-matosinhos-associacao-recreativa-guerra-junqueiro",
      "title": "Rever: Associação Recreativa Guerra Junqueiro",
      "type": "review",
      "owner": "human",
      "timing": {
        "kind": "unknown"
      },
      "state": "unknown",
      "remindersDays": [],
      "dependsOn": [],
      "issueNumber": 24,
      "source": null,
      "notes": "Revisão dos dados pesquisados; comentar aceite ou rejeitado na issue."
    },
    {
      "id": "review-matosinhos-assus",
      "title": "Rever: ASSUS",
      "type": "review",
      "owner": "human",
      "timing": {
        "kind": "unknown"
      },
      "state": "unknown",
      "remindersDays": [],
      "dependsOn": [],
      "issueNumber": 25,
      "source": null,
      "notes": "Revisão dos dados pesquisados; comentar aceite ou rejeitado na issue."
    },
    {
      "id": "review-matosinhos-casa-do-povo-de-santa-cruz-do-bispo",
      "title": "Rever: Casa do Povo de Santa Cruz do Bispo",
      "type": "review",
      "owner": "human",
      "timing": {
        "kind": "unknown"
      },
      "state": "unknown",
      "remindersDays": [],
      "dependsOn": [],
      "issueNumber": 26,
      "source": null,
      "notes": "Revisão dos dados pesquisados; comentar aceite ou rejeitado na issue."
    },
    {
      "id": "review-matosinhos-ccssg-centro-cultural-de-solidariedade-social-de-guifoes",
      "title": "Rever: CCSSG - Centro Cultural de Solidariedade Social de Guifões",
      "type": "review",
      "owner": "human",
      "timing": {
        "kind": "unknown"
      },
      "state": "unknown",
      "remindersDays": [],
      "dependsOn": [],
      "issueNumber": 27,
      "source": null,
      "notes": "Revisão dos dados pesquisados; comentar aceite ou rejeitado na issue."
    },
    {
      "id": "review-matosinhos-centro-infantil-de-sao-mamede-de-infesta",
      "title": "Rever: Centro Infantil de São Mamede de Infesta",
      "type": "review",
      "owner": "human",
      "timing": {
        "kind": "unknown"
      },
      "state": "unknown",
      "remindersDays": [],
      "dependsOn": [],
      "issueNumber": 28,
      "source": null,
      "notes": "Revisão dos dados pesquisados; comentar aceite ou rejeitado na issue."
    },
    {
      "id": "review-matosinhos-centro-social-de-leca-do-balio-manso",
      "title": "Rever: Centro Social de Leça do Balio (Manso)",
      "type": "review",
      "owner": "human",
      "timing": {
        "kind": "unknown"
      },
      "state": "unknown",
      "remindersDays": [],
      "dependsOn": [],
      "issueNumber": 29,
      "source": null,
      "notes": "Revisão dos dados pesquisados; comentar aceite ou rejeitado na issue."
    },
    {
      "id": "review-matosinhos-centro-social-de-leca-do-balio-recarei",
      "title": "Rever: Centro Social de Leça do Balio (Recarei)",
      "type": "review",
      "owner": "human",
      "timing": {
        "kind": "unknown"
      },
      "state": "unknown",
      "remindersDays": [],
      "dependsOn": [],
      "issueNumber": 30,
      "source": null,
      "notes": "Revisão dos dados pesquisados; comentar aceite ou rejeitado na issue."
    },
    {
      "id": "review-matosinhos-cooperativa-sete-bicas",
      "title": "Rever: Cooperativa \"As Sete Bicas\"",
      "type": "review",
      "owner": "human",
      "timing": {
        "kind": "unknown"
      },
      "state": "unknown",
      "remindersDays": [],
      "dependsOn": [],
      "issueNumber": 31,
      "source": null,
      "notes": "Revisão dos dados pesquisados; comentar aceite ou rejeitado na issue."
    },
    {
      "id": "review-matosinhos-cooperativa-solinorte",
      "title": "Rever: Cooperativa Solinorte",
      "type": "review",
      "owner": "human",
      "timing": {
        "kind": "unknown"
      },
      "state": "unknown",
      "remindersDays": [],
      "dependsOn": [],
      "issueNumber": 32,
      "source": null,
      "notes": "Revisão dos dados pesquisados; comentar aceite ou rejeitado na issue."
    },
    {
      "id": "review-matosinhos-jardim-de-infancia-santa-cecilia",
      "title": "Rever: Jardim de Infância Santa Cecília",
      "type": "review",
      "owner": "human",
      "timing": {
        "kind": "unknown"
      },
      "state": "unknown",
      "remindersDays": [],
      "dependsOn": [],
      "issueNumber": 33,
      "source": null,
      "notes": "Revisão dos dados pesquisados; comentar aceite ou rejeitado na issue."
    },
    {
      "id": "review-porto-ramalde-a-casa-do-cuco",
      "title": "Rever: A Casa do Cuco (Laura Pinto, Lda.)",
      "type": "review",
      "owner": "human",
      "timing": {
        "kind": "unknown"
      },
      "state": "unknown",
      "remindersDays": [],
      "dependsOn": [],
      "issueNumber": 34,
      "source": null,
      "notes": "Revisão dos dados pesquisados; comentar aceite ou rejeitado na issue."
    },
    {
      "id": "review-porto-ramalde-amds-creche-infantario-atl",
      "title": "Rever: A M D S Creche, Infantário e ATL, Lda.",
      "type": "review",
      "owner": "human",
      "timing": {
        "kind": "unknown"
      },
      "state": "unknown",
      "remindersDays": [],
      "dependsOn": [],
      "issueNumber": 35,
      "source": null,
      "notes": "Revisão dos dados pesquisados; comentar aceite ou rejeitado na issue."
    },
    {
      "id": "review-porto-ramalde-centro-social-paroquial-do-carvalhido",
      "title": "Rever: Centro Social Paroquial do Carvalhido",
      "type": "review",
      "owner": "human",
      "timing": {
        "kind": "unknown"
      },
      "state": "unknown",
      "remindersDays": [],
      "dependsOn": [],
      "issueNumber": 36,
      "source": null,
      "notes": "Revisão dos dados pesquisados; comentar aceite ou rejeitado na issue."
    },
    {
      "id": "review-porto-ramalde-colegio-de-nossa-senhora-do-rosario",
      "title": "Rever: Colégio de Nossa Senhora do Rosário",
      "type": "review",
      "owner": "human",
      "timing": {
        "kind": "unknown"
      },
      "state": "unknown",
      "remindersDays": [],
      "dependsOn": [],
      "issueNumber": 37,
      "source": null,
      "notes": "Revisão dos dados pesquisados; comentar aceite ou rejeitado na issue."
    },
    {
      "id": "review-porto-ramalde-colegio-espinheira-rio",
      "title": "Rever: Colégio Espinheira Rio",
      "type": "review",
      "owner": "human",
      "timing": {
        "kind": "unknown"
      },
      "state": "unknown",
      "remindersDays": [],
      "dependsOn": [],
      "issueNumber": 38,
      "source": null,
      "notes": "Revisão dos dados pesquisados; comentar aceite ou rejeitado na issue."
    },
    {
      "id": "review-porto-ramalde-creche-o-patati",
      "title": "Rever: Creche O Patati",
      "type": "review",
      "owner": "human",
      "timing": {
        "kind": "unknown"
      },
      "state": "unknown",
      "remindersDays": [],
      "dependsOn": [],
      "issueNumber": 39,
      "source": null,
      "notes": "Revisão dos dados pesquisados; comentar aceite ou rejeitado na issue."
    },
    {
      "id": "review-porto-ramalde-externato-s-joao-de-brito",
      "title": "Rever: Externato S. João de Brito (EIPM)",
      "type": "review",
      "owner": "human",
      "timing": {
        "kind": "unknown"
      },
      "state": "unknown",
      "remindersDays": [],
      "dependsOn": [],
      "issueNumber": 40,
      "source": null,